{"claim_boundary":"The public page reports 84.5% over eight UniVTAC tasks with 100 randomized trials per simulation task, but does not publish the exact checkpoint, ordered seed list, or full renderer/runtime inventory. RoboTactile therefore binds its released evaluator to the training-aligned 60 Hz EE endpoint contract without claiming that this is the unpublished paper-exact implementation.","evaluation_semantics":"official_reproduction","metric_name":"UniVTAC eight-task macro success rate","reference_id":"n0_twam_univtac_public_result_v1","report_snapshot_sha256":null,"report_url":"https://research.neoteai.com/n0-twam/","reported_macro_success_rate":0.845,"required_action_execution":"robotactile_n0_training_60hz_ee_v1","required_exception_handling":"replace_exception_until_target_valid_v1","required_policy_kind":"n0","required_protocol_id":"paper_v1","required_reset_mode":"eval","required_seed_protocol":"univtac_consecutive_task_seed_v1","semantic_version":"1.0","task_ids":["grasp_classify","insert_HDMI","insert_hole","insert_tube","lift_bottle","lift_can","pull_out_key","put_bottle_in_shelf"],"trials_per_task":100}
